{
  "$schema": "https://json-schema.org/draft/2020-12/schema",
  "title": "AgentCard",
  "type": "object",
  "required": [
    "name",
    "description",
    "version",
    "capabilities",
    "skills",
    "defaultInputModes",
    "defaultOutputModes"
  ],
  "properties": {
    "name": {
      "type": "string",
      "minLength": 1
    },
    "description": {
      "type": "string",
      "minLength": 1
    },
    "version": {
      "type": "string",
      "pattern": "^\\d+\\.\\d+\\.\\d+$"
    },
    "url": {
      "type": "string",
      "format": "uri"
    },
    "capabilities": {
      "type": "object",
      "required": ["supportsStreaming", "supportsTools"],
      "properties": {
        "supportsStreaming": { "type": "boolean" },
        "supportsTools": { "type": "boolean" }
      },
      "additionalProperties": false
    },
    "skills": {
      "type": "array",
      "minItems": 1,
      "items": {
        "type": "object",
        "required": ["id", "name", "description", "tags"],
        "properties": {
          "id": {
            "type": "string",
            "pattern": "^[a-zA-Z0-9_]+$"
          },
          "name": { "type": "string" },
          "description": { "type": "string" },
          "tags": {
            "type": "array",
            "minItems": 1,
            "items": { "type": "string" }
          }
        },
        "additionalProperties": false
      }
    },
    "defaultInputModes": {
      "type": "array",
      "items": { "type": "string" },
      "minItems": 1
    },
    "defaultOutputModes": {
      "type": "array",
      "items": { "type": "string" },
      "minItems": 1
    }
  },
  "additionalProperties": false
}
